{
  "schemaVersion": "1.0.0",
  "attachmentId": "cccccccc-cccc-4ccc-8ccc-cccccccccccc",
  "runId": "11111111-1111-4111-8111-111111111111",
  "direction": "INPUT",
  "status": "READY",
  "mimeType": "image/png",
  "sizeBytes": 1024,
  "checksumSha256": "bbbbbbbbbbbbbbbbbbbbbbbbbbbbbbbbbbbbbbbbbbbbbbbbbbbbbbbbbbbbbbbb",
  "capability": "attachment-cap-0123456789abcdef",
  "expiresAt": "2026-07-13T12:10:00.000Z",
  "fileName": "screenshot.png"
}
